{
  "schemaVersion": 1,
  "source": {
    "artifact": "generated/studio/capability-matrix.json",
    "schemaVersion": 2,
    "packagePin": "github:EIAS79/Apexify.js#a68053f87c0e69f077c4e1a58561511fe3aed68a",
    "implementationComplete": true,
    "totalCapabilities": 187
  },
  "classificationVocabulary": [
    "visual-property",
    "visual-object",
    "visual-operation",
    "timeline-operation",
    "project-operation",
    "export-only",
    "hosted-runtime-exclusion",
    "not-applicable"
  ],
  "rows": [
    {
      "capability": "ApexPainter.animate",
      "sourceRoute": "full-runtime",
      "classification": "timeline-operation",
      "domain": "animation",
      "editorSection": "Timeline / Animation",
      "controlSchemaId": "studio.visual.controls.animation",
      "projectModelField": "timelines",
      "previewRuntimeRoute": "full-runtime",
      "codegen": {
        "strategy": "direct-public-api",
        "symbol": "ApexPainter.animate"
      },
      "proofCaseIds": [
        "animation"
      ],
      "phaseOwner": "STUDIO-VISUAL-11",
      "implementationState": "implemented"
    },
    {
      "capability": "ApexPainter.assets.clear",
      "sourceRoute": "full-runtime",
      "classification": "project-operation",
      "domain": "assets",
      "editorSection": "Assets",
      "controlSchemaId": "studio.visual.controls.assets",
      "projectModelField": "assets",
      "previewRuntimeRoute": "full-runtime",
      "codegen": {
        "strategy": "direct-public-api",
        "symbol": "ApexPainter.assets.clear"
      },
      "proofCaseIds": [
        "assets"
      ],
      "phaseOwner": "STUDIO-VISUAL-9",
      "implementationState": "implemented"
    },
    {
      "capability": "ApexPainter.assets.delete",
      "sourceRoute": "full-runtime",
      "classification": "project-operation",
      "domain": "assets",
      "editorSection": "Assets",
      "controlSchemaId": "studio.visual.controls.assets",
      "projectModelField": "assets",
      "previewRuntimeRoute": "full-runtime",
      "codegen": {
        "strategy": "direct-public-api",
        "symbol": "ApexPainter.assets.delete"
      },
      "proofCaseIds": [
        "assets"
      ],
      "phaseOwner": "STUDIO-VISUAL-9",
      "implementationState": "implemented"
    },
    {
      "capability": "ApexPainter.assets.has",
      "sourceRoute": "full-runtime",
      "classification": "project-operation",
      "domain": "assets",
      "editorSection": "Assets",
      "controlSchemaId": "studio.visual.controls.assets",
      "projectModelField": "assets",
      "previewRuntimeRoute": "full-runtime",
      "codegen": {
        "strategy": "direct-public-api",
        "symbol": "ApexPainter.assets.has"
      },
      "proofCaseIds": [
        "assets"
      ],
      "phaseOwner": "STUDIO-VISUAL-9",
      "implementationState": "implemented"
    },
    {
      "capability": "ApexPainter.assets.list",
      "sourceRoute": "full-runtime",
      "classification": "project-operation",
      "domain": "assets",
      "editorSection": "Assets",
      "controlSchemaId": "studio.visual.controls.assets",
      "projectModelField": "assets",
      "previewRuntimeRoute": "full-runtime",
      "codegen": {
        "strategy": "direct-public-api",
        "symbol": "ApexPainter.assets.list"
      },
      "proofCaseIds": [
        "assets"
      ],
      "phaseOwner": "STUDIO-VISUAL-9",
      "implementationState": "implemented"
    },
    {
      "capability": "ApexPainter.assets.loadFont",
      "sourceRoute": "full-runtime",
      "classification": "project-operation",
      "domain": "assets",
      "editorSection": "Assets",
      "controlSchemaId": "studio.visual.controls.assets",
      "projectModelField": "assets",
      "previewRuntimeRoute": "full-runtime",
      "codegen": {
        "strategy": "direct-public-api",
        "symbol": "ApexPainter.assets.loadFont"
      },
      "proofCaseIds": [
        "assets"
      ],
      "phaseOwner": "STUDIO-VISUAL-9",
      "implementationState": "implemented"
    },
    {
      "capability": "ApexPainter.assets.loadImage",
      "sourceRoute": "full-runtime",
      "classification": "project-operation",
      "domain": "assets",
      "editorSection": "Assets",
      "controlSchemaId": "studio.visual.controls.assets",
      "projectModelField": "assets",
      "previewRuntimeRoute": "full-runtime",
      "codegen": {
        "strategy": "direct-public-api",
        "symbol": "ApexPainter.assets.loadImage"
      },
      "proofCaseIds": [
        "assets"
      ],
      "phaseOwner": "STUDIO-VISUAL-9",
      "implementationState": "implemented"
    },
    {
      "capability": "ApexPainter.assets.loadPalette",
      "sourceRoute": "full-runtime",
      "classification": "project-operation",
      "domain": "assets",
      "editorSection": "Assets",
      "controlSchemaId": "studio.visual.controls.assets",
      "projectModelField": "assets",
      "previewRuntimeRoute": "full-runtime",
      "codegen": {
        "strategy": "direct-public-api",
        "symbol": "ApexPainter.assets.loadPalette"
      },
      "proofCaseIds": [
        "assets"
      ],
      "phaseOwner": "STUDIO-VISUAL-9",
      "implementationState": "implemented"
    },
    {
      "capability": "ApexPainter.assets.loadValue",
      "sourceRoute": "full-runtime",
      "classification": "project-operation",
      "domain": "assets",
      "editorSection": "Assets",
      "controlSchemaId": "studio.visual.controls.assets",
      "projectModelField": "assets",
      "previewRuntimeRoute": "full-runtime",
      "codegen": {
        "strategy": "direct-public-api",
        "symbol": "ApexPainter.assets.loadValue"
      },
      "proofCaseIds": [
        "assets"
      ],
      "phaseOwner": "STUDIO-VISUAL-9",
      "implementationState": "implemented"
    },
    {
      "capability": "ApexPainter.assets.replaceFont",
      "sourceRoute": "full-runtime",
      "classification": "project-operation",
      "domain": "assets",
      "editorSection": "Assets",
      "controlSchemaId": "studio.visual.controls.assets",
      "projectModelField": "assets",
      "previewRuntimeRoute": "full-runtime",
      "codegen": {
        "strategy": "direct-public-api",
        "symbol": "ApexPainter.assets.replaceFont"
      },
      "proofCaseIds": [
        "assets"
      ],
      "phaseOwner": "STUDIO-VISUAL-9",
      "implementationState": "implemented"
    },
    {
      "capability": "ApexPainter.assets.replaceImage",
      "sourceRoute": "full-runtime",
      "classification": "project-operation",
      "domain": "assets",
      "editorSection": "Assets",
      "controlSchemaId": "studio.visual.controls.assets",
      "projectModelField": "assets",
      "previewRuntimeRoute": "full-runtime",
      "codegen": {
        "strategy": "direct-public-api",
        "symbol": "ApexPainter.assets.replaceImage"
      },
      "proofCaseIds": [
        "assets"
      ],
      "phaseOwner": "STUDIO-VISUAL-9",
      "implementationState": "implemented"
    },
    {
      "capability": "ApexPainter.assets.replacePalette",
      "sourceRoute": "full-runtime",
      "classification": "project-operation",
      "domain": "assets",
      "editorSection": "Assets",
      "controlSchemaId": "studio.visual.controls.assets",
      "projectModelField": "assets",
      "previewRuntimeRoute": "full-runtime",
      "codegen": {
        "strategy": "direct-public-api",
        "symbol": "ApexPainter.assets.replacePalette"
      },
      "proofCaseIds": [
        "assets"
      ],
      "phaseOwner": "STUDIO-VISUAL-9",
      "implementationState": "implemented"
    },
    {
      "capability": "ApexPainter.assets.replaceValue",
      "sourceRoute": "full-runtime",
      "classification": "project-operation",
      "domain": "assets",
      "editorSection": "Assets",
      "controlSchemaId": "studio.visual.controls.assets",
      "projectModelField": "assets",
      "previewRuntimeRoute": "full-runtime",
      "codegen": {
        "strategy": "direct-public-api",
        "symbol": "ApexPainter.assets.replaceValue"
      },
      "proofCaseIds": [
        "assets"
      ],
      "phaseOwner": "STUDIO-VISUAL-9",
      "implementationState": "implemented"
    },
    {
      "capability": "ApexPainter.assets.resolve",
      "sourceRoute": "full-runtime",
      "classification": "project-operation",
      "domain": "assets",
      "editorSection": "Assets",
      "controlSchemaId": "studio.visual.controls.assets",
      "projectModelField": "assets",
      "previewRuntimeRoute": "full-runtime",
      "codegen": {
        "strategy": "direct-public-api",
        "symbol": "ApexPainter.assets.resolve"
      },
      "proofCaseIds": [
        "assets"
      ],
      "phaseOwner": "STUDIO-VISUAL-9",
      "implementationState": "implemented"
    },
    {
      "capability": "ApexPainter.assets.unregisterFont",
      "sourceRoute": "full-runtime",
      "classification": "project-operation",
      "domain": "assets",
      "editorSection": "Assets",
      "controlSchemaId": "studio.visual.controls.assets",
      "projectModelField": "assets",
      "previewRuntimeRoute": "full-runtime",
      "codegen": {
        "strategy": "direct-public-api",
        "symbol": "ApexPainter.assets.unregisterFont"
      },
      "proofCaseIds": [
        "assets"
      ],
      "phaseOwner": "STUDIO-VISUAL-9",
      "implementationState": "implemented"
    },
    {
      "capability": "ApexPainter.assets.unregisterImage",
      "sourceRoute": "full-runtime",
      "classification": "project-operation",
      "domain": "assets",
      "editorSection": "Assets",
      "controlSchemaId": "studio.visual.controls.assets",
      "projectModelField": "assets",
      "previewRuntimeRoute": "full-runtime",
      "codegen": {
        "strategy": "direct-public-api",
        "symbol": "ApexPainter.assets.unregisterImage"
      },
      "proofCaseIds": [
        "assets"
      ],